{
  "name": "value-stream-1-default",
  "description": "Default bundle for value stream 1: Confluence publishing, architecture doc generation, Jira ticketing from code, and Atlassian MCP.",
  "version": "1.0.0",
  "author": {"name": "danforceDJ"},
  "license": "MIT",
  "keywords": ["atlassian", "confluence", "jira", "architecture", "bundle"],
  "category": "bundles",
  "tags": ["atlassian", "bundle", "workflow"],
  "skills": ["publish-to-confluence", "generate-architecture-doc", "jira-ticket-from-code"],
  "mcpServers": ["atlassian","aws-documentation-mcp"]
}
